----------------------------------------------------------------------------
CrystalDiskInfo 8.17.5 (C) 2008-2022 hiyohiyo
                                Crystal Dew World: https://crystalmark.info/
----------------------------------------------------------------------------

    OS : Windows 11 Professional [10.0 Build 22623] (x64)
  Date : 2023/03/15 8:09:46

-- Controller Map ----------------------------------------------------------
 + Стандартный контроллер SATA AHCI [ATA]
   - Patriot Burst Elite 480GB
 - Контроллер дискового пространства (Майкрософт) [SCSI]
 + Контроллер замыкания виртуального жесткого диска на себя (Майкрософт) [SCSI]
   - Виртуальный DVD-диск (Майкрософт)

-- Disk List ---------------------------------------------------------------
 (01) Patriot Burst Elite 480GB : 480,1 GB [0/0/0, pd1] - sm

----------------------------------------------------------------------------
 (01) Patriot Burst Elite 480GB
----------------------------------------------------------------------------
           Model : Patriot Burst Elite 480GB
        Firmware : HCS1A25E
   Serial Number : PBEIICB22082507799
       Disk Size : 480,1 GB (8,4/137,4/480,1/480,1)
     Buffer Size : Unknown
     Queue Depth : 32
    # of Sectors : 937703088
   Rotation Rate : ---- (SSD)
       Interface : Serial ATA
   Major Version : ACS-2
   Minor Version : ACS-2 Revision 3
   Transfer Mode : SATA/600 | SATA/600
  Power On Hours : 1599 hours
  Power On Count : 16 count
      Host Reads : 1754 GB
     Host Writes : 1365 GB
     NAND Writes : 2690 GB
     Temperature : 45 C (113 F)
   Health Status : Good (100 %)
        Features : S.M.A.R.T., NCQ, TRIM, GPL
       APM Level : ----
       AAM Level : ----
    Drive Letter : C:

-- S.M.A.R.T. --------------------------------------------------------------
ID Cur Wor Thr RawValues(6) Attribute Name
01 100 100 _50 000000000000 Read Error Rate
05 100 100 _50 000000000000 Reallocated Sectors Count
09 100 100 _50 00000000063F Power-On Hours
0C 100 100 _50 000000000010 Power Cycle Count
A0 100 100 _50 00000000002D Uncorrectable sectors count when read/write
A1 100 100 _50 000000000064 Number of Valid Spare Blocks
A3 100 100 _50 0000000001B8 Number of Initial Invalid Blocks
A4 100 100 _50 00000000000F Total Erase Count
A5 100 100 _50 000000000038 Maximum Erase Count
A6 100 100 _50 000000000001 Minimum Erase Count
A7 100 100 _50 000000000008 Average Erase Count
A8 100 100 _50 000000000000 Max Erase Count of Spec
A9 100 100 _50 000000000064 Remain Life
AF 100 100 _50 000000000000 Program fail count in worst die
B0 100 100 _50 0000000051BF Erase fail count in worst die
B1 100 100 _50 000001089386 Total Wear Level Count
B2 100 100 _50 000000000000 Runtime Invalid Block Count
B5 100 100 _50 000000000000 Total Program Fail Count
B6 100 100 _50 000000000000 Total Erase Fail Count
C0 100 100 _50 000000000004 Power-Off Retract Count
C2 100 100 _50 00000000002D Temperature
C3 100 100 _50 000000000036 Hardware ECC Recovered
C4 100 100 _50 000000000000 Reallocation Event Count
C5 100 100 _50 000000000000 Current Pending Sector Count
C6 100 100 _50 000000000000 Uncorrectable Error Count Off-line
C7 100 100 _50 000000000000 Ultra DMA CRC Error Count
E8 100 100 _50 000000000064 Available Reserved Space
F1 100 100 _50 00000000AABE Total LBA Written
F2 100 100 _50 00000000DB54 Total LBA Read
F5 100 100 _50 000000015052 Flash Write Sector Count

-- IDENTIFY_DEVICE ---------------------------------------------------------
        0    1    2    3    4    5    6    7    8    9
000: 0040 3FFF C837 0010 0000 0000 003F 0000 0000 0000
010: 5042 4549 4943 4232 3230 3832 3530 3737 3939 2020
020: 0000 0000 0000 4843 5331 4132 3545 5061 7472 696F
030: 7420 4275 7273 7420 456C 6974 6520 3438 3047 4220
040: 2020 2020 2020 2020 2020 2020 2020 8008 4000 2F00
050: 4000 0000 0000 0007 3FFF 0010 003F FC10 00FB 9101
060: FFFF 0FFF 0000 0007 0003 0078 0078 0078 0078 0C00
070: 0000 0000 0000 0000 0000 001F E50E 0006 0044 0040
080: 03FC 0110 706B 7400 4163 7469 B400 4163 017F 0001
090: 0001 0000 FFFE 0000 0000 0000 0000 0000 0000 0000
100: 36B0 37E4 0000 0000 0000 0008 4000 0000 0000 0000
110: 0000 0000 0000 0000 0000 0000 0000 0000 0000 4008
120: 4008 0000 0000 0000 0000 0000 0000 0000 0029 2020
130: 2020 2020 2020 2020 2020 2020 2020 2020 2020 2020
140: 2020 2020 2020 2020 2020 8900 0049 2C01 1CD3 C632
150: 0000 4100 2220 2508 000C 5359 0000 0000 0000 0000
160: 0000 0000 0000 0000 0000 0000 0000 0000 0003 0001
170: 2020 2020 2020 2020 0000 0000 2020 2020 2020 2020
180: 2020 2020 2020 2020 2020 2020 2020 2020 2020 2020
190: 2020 2020 2020 2020 2020 2020 2020 2020 2020 2020
200: 2020 2020 2020 2020 2020 2020 0000 0000 0000 4000
210: 0000 0000 0000 0000 0000 0000 0000 0001 0000 0000
220: 0000 0000 10FF 0000 0000 0000 0000 0000 0000 0000
230: 0000 0000 0000 0000 0010 0010 0000 0000 0000 0000
240: 0000 0000 0000 0000 0000 0000 0000 0000 0000 0000
250: 0000 0000 0000 0000 0000 DAA5

-- SMART_READ_DATA ---------------------------------------------------------
     +0 +1 +2 +3 +4 +5 +6 +7 +8 +9 +A +B +C +D +E +F
000: 01 00 01 32 00 64 64 00 00 00 00 00 00 00 05 32
010: 00 64 64 00 00 00 00 00 00 00 09 32 00 64 64 3F
020: 06 00 00 00 00 00 0C 32 00 64 64 10 00 00 00 00
030: 00 00 A0 32 00 64 64 2D 00 00 00 00 00 00 A1 32
040: 00 64 64 64 00 00 00 00 00 00 A3 32 00 64 64 B8
050: 01 00 00 00 00 00 A4 32 00 64 64 0F 00 00 00 00
060: 00 00 A5 32 00 64 64 38 00 00 00 00 00 00 A6 32
070: 00 64 64 01 00 00 00 00 00 00 A7 32 00 64 64 08
080: 00 00 00 00 00 00 A8 32 00 64 64 00 00 00 00 00
090: 00 00 A9 32 00 64 64 64 00 00 00 00 00 00 AF 32
0A0: 00 64 64 00 00 00 00 00 00 00 B0 32 00 64 64 BF
0B0: 51 00 00 00 00 00 B1 32 00 64 64 86 93 08 01 00
0C0: 00 00 B2 32 00 64 64 00 00 00 00 00 00 00 B5 32
0D0: 00 64 64 00 00 00 00 00 00 00 B6 32 00 64 64 00
0E0: 00 00 00 00 00 00 C0 32 00 64 64 04 00 00 00 00
0F0: 00 00 C2 32 00 64 64 2D 00 00 00 00 00 00 C3 32
100: 00 64 64 36 00 00 00 00 00 00 C4 32 00 64 64 00
110: 00 00 00 00 00 00 C5 32 00 64 64 00 00 00 00 00
120: 00 00 C6 32 00 64 64 00 00 00 00 00 00 00 C7 32
130: 00 64 64 00 00 00 00 00 00 00 E8 32 00 64 64 64
140: 00 00 00 00 00 00 F1 32 00 64 64 BE AA 00 00 00
150: 00 00 F2 32 00 64 64 54 DB 00 00 00 00 00 F5 32
160: 00 64 64 52 50 01 00 00 00 00 00 00 78 00 00 5D
170: 02 00 01 00 02 04 00 4F 63 74 20 31 34 20 32 30
180: 32 31 00 00 00 00 00 00 00 00 00 00 00 00 00 00
190: 00 00 00 00 00 00 00 00 00 00 00 00 00 00 00 00
1A0: 00 00 00 00 00 00 00 00 00 00 00 00 00 00 00 00
1B0: 00 00 00 00 00 00 00 00 00 00 00 00 00 00 00 00
1C0: 00 00 00 00 00 00 00 00 00 00 00 00 00 00 00 00
1D0: 00 00 00 00 00 00 00 00 00 00 00 00 00 00 00 00
1E0: 00 00 00 00 00 00 00 00 00 00 00 00 00 00 00 00
1F0: 00 00 00 00 00 00 00 00 00 00 00 00 00 00 00 8D

-- SMART_READ_THRESHOLD ----------------------------------------------------
     +0 +1 +2 +3 +4 +5 +6 +7 +8 +9 +A +B +C +D +E +F
000: 01 00 01 32 00 00 00 00 00 00 00 00 00 00 05 32
010: 00 00 00 00 00 00 00 00 00 00 09 32 00 00 00 00
020: 00 00 00 00 00 00 0C 32 00 00 00 00 00 00 00 00
030: 00 00 A0 32 00 00 00 00 00 00 00 00 00 00 A1 32
040: 00 00 00 00 00 00 00 00 00 00 A3 32 00 00 00 00
050: 00 00 00 00 00 00 A4 32 00 00 00 00 00 00 00 00
060: 00 00 A5 32 00 00 00 00 00 00 00 00 00 00 A6 32
070: 00 00 00 00 00 00 00 00 00 00 A7 32 00 00 00 00
080: 00 00 00 00 00 00 A8 32 00 00 00 00 00 00 00 00
090: 00 00 A9 32 00 00 00 00 00 00 00 00 00 00 AF 32
0A0: 00 00 00 00 00 00 00 00 00 00 B0 32 00 00 00 00
0B0: 00 00 00 00 00 00 B1 32 00 00 00 00 00 00 00 00
0C0: 00 00 B2 32 00 00 00 00 00 00 00 00 00 00 B5 32
0D0: 00 00 00 00 00 00 00 00 00 00 B6 32 00 00 00 00
0E0: 00 00 00 00 00 00 C0 32 00 00 00 00 00 00 00 00
0F0: 00 00 C2 32 00 00 00 00 00 00 00 00 00 00 C3 32
100: 00 00 00 00 00 00 00 00 00 00 C4 32 00 00 00 00
110: 00 00 00 00 00 00 C5 32 00 00 00 00 00 00 00 00
120: 00 00 C6 32 00 00 00 00 00 00 00 00 00 00 C7 32
130: 00 00 00 00 00 00 00 00 00 00 E8 32 00 00 00 00
140: 00 00 00 00 00 00 F1 32 00 00 00 00 00 00 00 00
150: 00 00 F2 32 00 00 00 00 00 00 00 00 00 00 F5 32
160: 00 00 00 00 00 00 00 00 00 00 00 00 00 00 00 00
170: 00 00 00 00 00 00 00 00 00 00 00 00 00 00 00 00
180: 00 00 00 00 00 00 00 00 00 00 00 00 00 00 00 00
190: 00 00 00 00 00 00 00 00 00 00 00 00 00 00 00 00
1A0: 00 00 00 00 00 00 00 00 00 00 00 00 00 00 00 00
1B0: 00 00 00 00 00 00 00 00 00 00 00 00 00 00 00 00
1C0: 00 00 00 00 00 00 00 00 00 00 00 00 00 00 00 00
1D0: 00 00 00 00 00 00 00 00 00 00 00 00 00 00 00 00
1E0: 00 00 00 00 00 00 00 00 00 00 00 00 00 00 00 00
1F0: 00 00 00 00 00 00 00 00 00 00 00 00 00 00 00 F5

